tcpdump: verbose output suppressed, use -v or -vv for full protocol decode
listening on sender-eth0, link-type EN10MB (Ethernet), capture size 65535 bytes
1338628052.170178 IP 10.0.0.2.52392 > 124.11.0.2.5001: Flags [S], seq 4123456441, win 65280, options [mss 256,sackOK,TS val 2086979 ecr 0,nop,wscale 9], length 0
1338628052.370872 IP 10.0.0.2.52392 > 124.11.0.2.5001: Flags [.], ack 6511, win 65280, length 0
1338628052.370910 IP 10.0.0.2.52392 > 124.11.0.2.5001: Flags [.], seq 0:160, ack 1, win 65280, length 160
1338628052.370959 IP 10.0.0.2.52392 > 124.11.0.2.5001: Flags [.], seq 160:320, ack 1, win 65280, length 160
1338628052.371256 IP 10.0.0.2.52392 > 124.11.0.2.5001: Flags [.], seq 320:480, ack 1, win 65280, length 160
1338628052.371275 IP 10.0.0.2.52392 > 124.11.0.2.5001: Flags [.], seq 480:640, ack 1, win 65280, length 160
1338628052.371278 IP 10.0.0.2.52392 > 124.11.0.2.5001: Flags [.], seq 640:800, ack 1, win 65280, length 160
1338628052.371290 IP 10.0.0.2.52392 > 124.11.0.2.5001: Flags [.], seq 800:960, ack 1, win 65280, length 160
1338628052.371293 IP 10.0.0.2.52392 > 124.11.0.2.5001: Flags [.], seq 960:1120, ack 1, win 65280, length 160
1338628052.371301 IP 10.0.0.2.52392 > 124.11.0.2.5001: Flags [.], seq 1120:1280, ack 1, win 65280, length 160
1338628052.371303 IP 10.0.0.2.52392 > 124.11.0.2.5001: Flags [.], seq 1280:1440, ack 1, win 65280, length 160
1338628052.371803 IP 10.0.0.2.52392 > 124.11.0.2.5001: Flags [.], seq 1440:1600, ack 1, win 65280, length 160
1338628052.572722 IP 10.0.0.2.52392 > 124.11.0.2.5001: Flags [.], seq 1600:1760, ack 1, win 65280, length 160
1338628052.572741 IP 10.0.0.2.52392 > 124.11.0.2.5001: Flags [.], seq 1760:1920, ack 1, win 65280, length 160
1338628052.572767 IP 10.0.0.2.52392 > 124.11.0.2.5001: Flags [.], seq 1920:2080, ack 1, win 65280, length 160
1338628052.572769 IP 10.0.0.2.52392 > 124.11.0.2.5001: Flags [.], seq 2080:2240, ack 1, win 65280, length 160
1338628052.572774 IP 10.0.0.2.52392 > 124.11.0.2.5001: Flags [.], seq 2240:2400, ack 1, win 65280, length 160
1338628052.572776 IP 10.0.0.2.52392 > 124.11.0.2.5001: Flags [.], seq 320:480, ack 1, win 65280, length 160
1338628052.572780 IP 10.0.0.2.52392 > 124.11.0.2.5001: Flags [P.], seq 2400:2560, ack 1, win 65280, length 160
1338628052.574181 IP 10.0.0.2.52392 > 124.11.0.2.5001: Flags [.], seq 640:800, ack 1, win 65280, length 160
1338628052.574181 IP 10.0.0.2.52392 > 124.11.0.2.5001: Flags [.], seq 960:1120, ack 1, win 65280, length 160
1338628052.575648 IP 10.0.0.2.52392 > 124.11.0.2.5001: Flags [.], seq 2560:2720, ack 1, win 65280, length 160
1338628052.575673 IP 10.0.0.2.52392 > 124.11.0.2.5001: Flags [.], seq 2720:2880, ack 1, win 65280, length 160
1338628052.575697 IP 10.0.0.2.52392 > 124.11.0.2.5001: Flags [.], seq 2880:3040, ack 1, win 65280, length 160
1338628052.575714 IP 10.0.0.2.52392 > 124.11.0.2.5001: Flags [.], seq 3040:3200, ack 1, win 65280, length 160
1338628052.575734 IP 10.0.0.2.52392 > 124.11.0.2.5001: Flags [.], seq 3200:3360, ack 1, win 65280, length 160
1338628052.575751 IP 10.0.0.2.52392 > 124.11.0.2.5001: Flags [P.], seq 3360:3520, ack 1, win 65280, length 160
1338628052.576412 IP 10.0.0.2.52392 > 124.11.0.2.5001: Flags [.], seq 1280:1440, ack 1, win 65280, length 160
1338628052.577294 IP 10.0.0.2.52392 > 124.11.0.2.5001: Flags [.], seq 1600:1760, ack 1, win 65280, length 160
1338628052.773759 IP 10.0.0.2.52392 > 124.11.0.2.5001: Flags [.], seq 1920:2080, ack 1, win 65280, length 160
1338628052.774507 IP 10.0.0.2.52392 > 124.11.0.2.5001: Flags [.], seq 3520:3680, ack 1, win 65280, length 160
1338628052.774520 IP 10.0.0.2.52392 > 124.11.0.2.5001: Flags [.], seq 3680:3840, ack 1, win 65280, length 160
1338628052.774537 IP 10.0.0.2.52392 > 124.11.0.2.5001: Flags [.], seq 3840:4000, ack 1, win 65280, length 160
1338628052.774540 IP 10.0.0.2.52392 > 124.11.0.2.5001: Flags [P.], seq 4000:4096, ack 1, win 65280, length 96
1338628052.774547 IP 10.0.0.2.52392 > 124.11.0.2.5001: Flags [.], seq 2240:2400, ack 1, win 65280, length 160
1338628052.774550 IP 10.0.0.2.52392 > 124.11.0.2.5001: Flags [.], seq 2560:2720, ack 1, win 65280, length 160
1338628052.775078 IP 10.0.0.2.52392 > 124.11.0.2.5001: Flags [.], seq 4096:4256, ack 1, win 65280, length 160
1338628052.775116 IP 10.0.0.2.52392 > 124.11.0.2.5001: Flags [.], seq 4256:4416, ack 1, win 65280, length 160
1338628052.775159 IP 10.0.0.2.52392 > 124.11.0.2.5001: Flags [.], seq 4416:4576, ack 1, win 65280, length 160
1338628052.775201 IP 10.0.0.2.52392 > 124.11.0.2.5001: Flags [.], seq 4576:4736, ack 1, win 65280, length 160
1338628052.775211 IP 10.0.0.2.52392 > 124.11.0.2.5001: Flags [.], seq 4736:4896, ack 1, win 65280, length 160
1338628052.775214 IP 10.0.0.2.52392 > 124.11.0.2.5001: Flags [P.], seq 4896:5056, ack 1, win 65280, length 160
1338628052.778257 IP 10.0.0.2.52392 > 124.11.0.2.5001: Flags [.], seq 2880:3040, ack 1, win 65280, length 160
1338628052.778640 IP 10.0.0.2.52392 > 124.11.0.2.5001: Flags [.], seq 3200:3360, ack 1, win 65280, length 160
1338628052.778640 IP 10.0.0.2.52392 > 124.11.0.2.5001: Flags [.], seq 3520:3680, ack 1, win 65280, length 160
1338628052.779172 IP 10.0.0.2.52392 > 124.11.0.2.5001: Flags [.], seq 5056:5216, ack 1, win 65280, length 160
1338628052.779172 IP 10.0.0.2.52392 > 124.11.0.2.5001: Flags [.], seq 5216:5376, ack 1, win 65280, length 160
1338628052.779172 IP 10.0.0.2.52392 > 124.11.0.2.5001: Flags [.], seq 5376:5536, ack 1, win 65280, length 160
1338628052.779173 IP 10.0.0.2.52392 > 124.11.0.2.5001: Flags [.], seq 5536:5696, ack 1, win 65280, length 160
1338628052.779173 IP 10.0.0.2.52392 > 124.11.0.2.5001: Flags [.], seq 5696:5856, ack 1, win 65280, length 160
1338628052.779173 IP 10.0.0.2.52392 > 124.11.0.2.5001: Flags [P.], seq 5856:6016, ack 1, win 65280, length 160
1338628052.975844 IP 10.0.0.2.52392 > 124.11.0.2.5001: Flags [.], seq 3840:4000, ack 1, win 65280, length 160
1338628052.980279 IP 10.0.0.2.52392 > 124.11.0.2.5001: Flags [.], seq 4416:4576, ack 1, win 65280, length 160
1338628052.981738 IP 10.0.0.2.52392 > 124.11.0.2.5001: Flags [.], seq 6016:6176, ack 1, win 65280, length 160
1338628052.981753 IP 10.0.0.2.52392 > 124.11.0.2.5001: Flags [.], seq 6176:6336, ack 1, win 65280, length 160
1338628052.981772 IP 10.0.0.2.52392 > 124.11.0.2.5001: Flags [.], seq 6336:6496, ack 1, win 65280, length 160
1338628052.981781 IP 10.0.0.2.52392 > 124.11.0.2.5001: Flags [.], seq 6496:6656, ack 1, win 65280, length 160
1338628052.981793 IP 10.0.0.2.52392 > 124.11.0.2.5001: Flags [.], seq 6656:6816, ack 1, win 65280, length 160
1338628052.981803 IP 10.0.0.2.52392 > 124.11.0.2.5001: Flags [.], seq 4736:4896, ack 1, win 65280, length 160
1338628052.981815 IP 10.0.0.2.52392 > 124.11.0.2.5001: Flags [P.], seq 6816:6976, ack 1, win 65280, length 160
1338628052.981824 IP 10.0.0.2.52392 > 124.11.0.2.5001: Flags [.], seq 5056:5216, ack 1, win 65280, length 160
1338628052.981837 IP 10.0.0.2.52392 > 124.11.0.2.5001: Flags [.], seq 6976:7136, ack 1, win 65280, length 160
1338628052.982401 IP 10.0.0.2.52392 > 124.11.0.2.5001: Flags [.], seq 7136:7296, ack 1, win 65280, length 160
1338628052.982416 IP 10.0.0.2.52392 > 124.11.0.2.5001: Flags [.], seq 7296:7456, ack 1, win 65280, length 160
1338628052.982431 IP 10.0.0.2.52392 > 124.11.0.2.5001: Flags [P.], seq 7456:7616, ack 1, win 65280, length 160
1338628053.182455 IP 10.0.0.2.52392 > 124.11.0.2.5001: Flags [.], seq 6336:6496, ack 1, win 65280, length 160
1338628053.182470 IP 10.0.0.2.52392 > 124.11.0.2.5001: Flags [.], seq 7616:7776, ack 1, win 65280, length 160
1338628053.182495 IP 10.0.0.2.52392 > 124.11.0.2.5001: Flags [.], seq 7776:7936, ack 1, win 65280, length 160
1338628053.182497 IP 10.0.0.2.52392 > 124.11.0.2.5001: Flags [.], seq 7936:8096, ack 1, win 65280, length 160
1338628053.182501 IP 10.0.0.2.52392 > 124.11.0.2.5001: Flags [.], seq 8096:8256, ack 1, win 65280, length 160
1338628053.182502 IP 10.0.0.2.52392 > 124.11.0.2.5001: Flags [.], seq 8256:8416, ack 1, win 65280, length 160
1338628053.182513 IP 10.0.0.2.52392 > 124.11.0.2.5001: Flags [P.], seq 8416:8576, ack 1, win 65280, length 160
1338628053.182514 IP 10.0.0.2.52392 > 124.11.0.2.5001: Flags [.], seq 6656:6816, ack 1, win 65280, length 160
1338628053.183065 IP 10.0.0.2.52392 > 124.11.0.2.5001: Flags [P.], seq 6816:6976, ack 1, win 65280, length 160
1338628053.184045 IP 10.0.0.2.52392 > 124.11.0.2.5001: Flags [.], seq 6976:7136, ack 1, win 65280, length 160
1338628053.184249 IP 10.0.0.2.52392 > 124.11.0.2.5001: Flags [.], seq 7296:7456, ack 1, win 65280, length 160
1338628053.383631 IP 10.0.0.2.52392 > 124.11.0.2.5001: Flags [.], seq 8576:8736, ack 1, win 65280, length 160
1338628053.383658 IP 10.0.0.2.52392 > 124.11.0.2.5001: Flags [.], seq 8736:8896, ack 1, win 65280, length 160
1338628053.383698 IP 10.0.0.2.52392 > 124.11.0.2.5001: Flags [.], seq 8896:9056, ack 1, win 65280, length 160
1338628053.383701 IP 10.0.0.2.52392 > 124.11.0.2.5001: Flags [.], seq 9056:9216, ack 1, win 65280, length 160
1338628053.383708 IP 10.0.0.2.52392 > 124.11.0.2.5001: Flags [.], seq 9216:9376, ack 1, win 65280, length 160
1338628053.383711 IP 10.0.0.2.52392 > 124.11.0.2.5001: Flags [.], seq 9376:9536, ack 1, win 65280, length 160
1338628053.383718 IP 10.0.0.2.52392 > 124.11.0.2.5001: Flags [.], seq 9536:9696, ack 1, win 65280, length 160
1338628053.383721 IP 10.0.0.2.52392 > 124.11.0.2.5001: Flags [.], seq 9696:9856, ack 1, win 65280, length 160
1338628053.383728 IP 10.0.0.2.52392 > 124.11.0.2.5001: Flags [.], seq 9856:10016, ack 1, win 65280, length 160
1338628053.383731 IP 10.0.0.2.52392 > 124.11.0.2.5001: Flags [P.], seq 10016:10176, ack 1, win 65280, length 160
1338628053.383803 IP 10.0.0.2.52392 > 124.11.0.2.5001: Flags [.], seq 7936:8096, ack 1, win 65280, length 160
1338628053.383807 IP 10.0.0.2.52392 > 124.11.0.2.5001: Flags [.], seq 8256:8416, ack 1, win 65280, length 160
1338628053.383810 IP 10.0.0.2.52392 > 124.11.0.2.5001: Flags [.], seq 8576:8736, ack 1, win 65280, length 160
1338628053.385178 IP 10.0.0.2.52392 > 124.11.0.2.5001: Flags [.], seq 10176:10336, ack 1, win 65280, length 160
1338628053.385227 IP 10.0.0.2.52392 > 124.11.0.2.5001: Flags [.], seq 10336:10496, ack 1, win 65280, length 160
1338628053.385268 IP 10.0.0.2.52392 > 124.11.0.2.5001: Flags [.], seq 10496:10656, ack 1, win 65280, length 160
1338628053.385297 IP 10.0.0.2.52392 > 124.11.0.2.5001: Flags [.], seq 10656:10816, ack 1, win 65280, length 160
1338628053.385333 IP 10.0.0.2.52392 > 124.11.0.2.5001: Flags [.], seq 10816:10976, ack 1, win 65280, length 160
1338628053.385372 IP 10.0.0.2.52392 > 124.11.0.2.5001: Flags [P.], seq 10976:11136, ack 1, win 65280, length 160
1338628053.584940 IP 10.0.0.2.52392 > 124.11.0.2.5001: Flags [.], seq 8896:9056, ack 1, win 65280, length 160
1338628053.588047 IP 10.0.0.2.52392 > 124.11.0.2.5001: Flags [.], seq 9216:9376, ack 1, win 65280, length 160
1338628053.589189 IP 10.0.0.2.52392 > 124.11.0.2.5001: Flags [.], seq 9536:9696, ack 1, win 65280, length 160
1338628053.589225 IP 10.0.0.2.52392 > 124.11.0.2.5001: Flags [.], seq 9856:10016, ack 1, win 65280, length 160
1338628053.590625 IP 10.0.0.2.52392 > 124.11.0.2.5001: Flags [.], seq 11136:11296, ack 1, win 65280, length 160
1338628053.590633 IP 10.0.0.2.52392 > 124.11.0.2.5001: Flags [.], seq 11296:11456, ack 1, win 65280, length 160
1338628053.590644 IP 10.0.0.2.52392 > 124.11.0.2.5001: Flags [.], seq 11456:11616, ack 1, win 65280, length 160
1338628053.590646 IP 10.0.0.2.52392 > 124.11.0.2.5001: Flags [.], seq 11616:11776, ack 1, win 65280, length 160
1338628053.590651 IP 10.0.0.2.52392 > 124.11.0.2.5001: Flags [.], seq 11776:11936, ack 1, win 65280, length 160
1338628053.590654 IP 10.0.0.2.52392 > 124.11.0.2.5001: Flags [.], seq 11936:12096, ack 1, win 65280, length 160
1338628053.590659 IP 10.0.0.2.52392 > 124.11.0.2.5001: Flags [.], seq 12096:12256, ack 1, win 65280, length 160
1338628053.590661 IP 10.0.0.2.52392 > 124.11.0.2.5001: Flags [.], seq 12256:12416, ack 1, win 65280, length 160
1338628053.590666 IP 10.0.0.2.52392 > 124.11.0.2.5001: Flags [.], seq 12416:12576, ack 1, win 65280, length 160
1338628053.590668 IP 10.0.0.2.52392 > 124.11.0.2.5001: Flags [P.], seq 12576:12736, ack 1, win 65280, length 160
1338628053.590704 IP 10.0.0.2.52392 > 124.11.0.2.5001: Flags [.], seq 10496:10656, ack 1, win 65280, length 160
1338628053.591006 IP 10.0.0.2.52392 > 124.11.0.2.5001: Flags [.], seq 10816:10976, ack 1, win 65280, length 160
1338628053.931394 IP 10.0.0.2.52392 > 124.11.0.2.5001: Flags [P.], seq 10976:11136, ack 1, win 65280, length 160

112 packets captured
112 packets received by filter
0 packets dropped by kernel
