tcpdump: verbose output suppressed, use -v or -vv for full protocol decode
listening on sender-eth0, link-type EN10MB (Ethernet), capture size 65535 bytes
1338628025.575746 IP 10.0.0.2.39100 > 178.11.0.2.5001: Flags [S], seq 3661472290, win 65280, options [mss 256,sackOK,TS val 2080330 ecr 0,nop,wscale 9], length 0
1338628025.777165 IP 10.0.0.2.39100 > 178.11.0.2.5001: Flags [.], ack 6511, win 65280, length 0
1338628025.777187 IP 10.0.0.2.39100 > 178.11.0.2.5001: Flags [.], seq 0:160, ack 1, win 65280, length 160
1338628025.777223 IP 10.0.0.2.39100 > 178.11.0.2.5001: Flags [.], seq 160:320, ack 1, win 65280, length 160
1338628025.777233 IP 10.0.0.2.39100 > 178.11.0.2.5001: Flags [.], seq 320:480, ack 1, win 65280, length 160
1338628025.777246 IP 10.0.0.2.39100 > 178.11.0.2.5001: Flags [.], seq 480:640, ack 1, win 65280, length 160
1338628025.777256 IP 10.0.0.2.39100 > 178.11.0.2.5001: Flags [.], seq 640:800, ack 1, win 65280, length 160
1338628025.777271 IP 10.0.0.2.39100 > 178.11.0.2.5001: Flags [.], seq 800:960, ack 1, win 65280, length 160
1338628025.777281 IP 10.0.0.2.39100 > 178.11.0.2.5001: Flags [.], seq 960:1120, ack 1, win 65280, length 160
1338628025.777294 IP 10.0.0.2.39100 > 178.11.0.2.5001: Flags [.], seq 1120:1280, ack 1, win 65280, length 160
1338628025.777304 IP 10.0.0.2.39100 > 178.11.0.2.5001: Flags [.], seq 1280:1440, ack 1, win 65280, length 160
1338628025.777340 IP 10.0.0.2.39100 > 178.11.0.2.5001: Flags [.], seq 1440:1600, ack 1, win 65280, length 160
1338628025.977894 IP 10.0.0.2.39100 > 178.11.0.2.5001: Flags [.], seq 1600:1760, ack 1, win 65280, length 160
1338628025.977908 IP 10.0.0.2.39100 > 178.11.0.2.5001: Flags [.], seq 1760:1920, ack 1, win 65280, length 160
1338628025.977927 IP 10.0.0.2.39100 > 178.11.0.2.5001: Flags [.], seq 1920:2080, ack 1, win 65280, length 160
1338628025.977928 IP 10.0.0.2.39100 > 178.11.0.2.5001: Flags [.], seq 2080:2240, ack 1, win 65280, length 160
1338628025.977932 IP 10.0.0.2.39100 > 178.11.0.2.5001: Flags [.], seq 2240:2400, ack 1, win 65280, length 160
1338628025.977933 IP 10.0.0.2.39100 > 178.11.0.2.5001: Flags [P.], seq 2400:2560, ack 1, win 65280, length 160
1338628025.977937 IP 10.0.0.2.39100 > 178.11.0.2.5001: Flags [.], seq 2560:2720, ack 1, win 65280, length 160
1338628025.977938 IP 10.0.0.2.39100 > 178.11.0.2.5001: Flags [.], seq 2720:2880, ack 1, win 65280, length 160
1338628025.977941 IP 10.0.0.2.39100 > 178.11.0.2.5001: Flags [.], seq 2880:3040, ack 1, win 65280, length 160
1338628025.977942 IP 10.0.0.2.39100 > 178.11.0.2.5001: Flags [.], seq 3040:3200, ack 1, win 65280, length 160
1338628025.977979 IP 10.0.0.2.39100 > 178.11.0.2.5001: Flags [.], seq 3200:3360, ack 1, win 65280, length 160
1338628025.977981 IP 10.0.0.2.39100 > 178.11.0.2.5001: Flags [.], seq 3360:3520, ack 1, win 65280, length 160
1338628025.977982 IP 10.0.0.2.39100 > 178.11.0.2.5001: Flags [.], seq 3520:3680, ack 1, win 65280, length 160
1338628025.977984 IP 10.0.0.2.39100 > 178.11.0.2.5001: Flags [.], seq 3680:3840, ack 1, win 65280, length 160
1338628026.178561 IP 10.0.0.2.39100 > 178.11.0.2.5001: Flags [.], seq 3840:4000, ack 1, win 65280, length 160
1338628026.178571 IP 10.0.0.2.39100 > 178.11.0.2.5001: Flags [.], seq 4000:4160, ack 1, win 65280, length 160
1338628026.178587 IP 10.0.0.2.39100 > 178.11.0.2.5001: Flags [.], seq 4160:4320, ack 1, win 65280, length 160
1338628026.178588 IP 10.0.0.2.39100 > 178.11.0.2.5001: Flags [.], seq 4320:4480, ack 1, win 65280, length 160
1338628026.178591 IP 10.0.0.2.39100 > 178.11.0.2.5001: Flags [.], seq 4480:4640, ack 1, win 65280, length 160
1338628026.178593 IP 10.0.0.2.39100 > 178.11.0.2.5001: Flags [.], seq 4640:4800, ack 1, win 65280, length 160
1338628026.178598 IP 10.0.0.2.39100 > 178.11.0.2.5001: Flags [.], seq 4800:4960, ack 1, win 65280, length 160
1338628026.178599 IP 10.0.0.2.39100 > 178.11.0.2.5001: Flags [.], seq 4960:5120, ack 1, win 65280, length 160
1338628026.178602 IP 10.0.0.2.39100 > 178.11.0.2.5001: Flags [.], seq 5120:5280, ack 1, win 65280, length 160
1338628026.178603 IP 10.0.0.2.39100 > 178.11.0.2.5001: Flags [.], seq 5280:5440, ack 1, win 65280, length 160
1338628026.178642 IP 10.0.0.2.39100 > 178.11.0.2.5001: Flags [.], seq 5440:5600, ack 1, win 65280, length 160
1338628026.178644 IP 10.0.0.2.39100 > 178.11.0.2.5001: Flags [.], seq 5600:5760, ack 1, win 65280, length 160
1338628026.178645 IP 10.0.0.2.39100 > 178.11.0.2.5001: Flags [.], seq 5760:5920, ack 1, win 65280, length 160
1338628026.178646 IP 10.0.0.2.39100 > 178.11.0.2.5001: Flags [.], seq 5920:6080, ack 1, win 65280, length 160
1338628026.178647 IP 10.0.0.2.39100 > 178.11.0.2.5001: Flags [.], seq 6080:6240, ack 1, win 65280, length 160
1338628026.178648 IP 10.0.0.2.39100 > 178.11.0.2.5001: Flags [.], seq 6240:6400, ack 1, win 65280, length 160
1338628026.178649 IP 10.0.0.2.39100 > 178.11.0.2.5001: Flags [.], seq 6400:6560, ack 1, win 65280, length 160
1338628026.178650 IP 10.0.0.2.39100 > 178.11.0.2.5001: Flags [.], seq 6560:6720, ack 1, win 65280, length 160
1338628026.178651 IP 10.0.0.2.39100 > 178.11.0.2.5001: Flags [.], seq 6720:6880, ack 1, win 65280, length 160
1338628026.178652 IP 10.0.0.2.39100 > 178.11.0.2.5001: Flags [.], seq 6880:7040, ack 1, win 65280, length 160
1338628026.178653 IP 10.0.0.2.39100 > 178.11.0.2.5001: Flags [.], seq 7040:7200, ack 1, win 65280, length 160
1338628026.379485 IP 10.0.0.2.39100 > 178.11.0.2.5001: Flags [.], seq 7200:7360, ack 1, win 65280, length 160
1338628026.379500 IP 10.0.0.2.39100 > 178.11.0.2.5001: Flags [.], seq 7360:7520, ack 1, win 65280, length 160
1338628026.379536 IP 10.0.0.2.39100 > 178.11.0.2.5001: Flags [.], seq 7520:7680, ack 1, win 65280, length 160
1338628026.379539 IP 10.0.0.2.39100 > 178.11.0.2.5001: Flags [.], seq 7680:7840, ack 1, win 65280, length 160
1338628026.379551 IP 10.0.0.2.39100 > 178.11.0.2.5001: Flags [P.], seq 7840:8000, ack 1, win 65280, length 160
1338628026.379552 IP 10.0.0.2.39100 > 178.11.0.2.5001: Flags [.], seq 8000:8160, ack 1, win 65280, length 160
1338628026.379555 IP 10.0.0.2.39100 > 178.11.0.2.5001: Flags [.], seq 8160:8320, ack 1, win 65280, length 160
1338628026.379556 IP 10.0.0.2.39100 > 178.11.0.2.5001: Flags [.], seq 8320:8480, ack 1, win 65280, length 160
1338628026.379559 IP 10.0.0.2.39100 > 178.11.0.2.5001: Flags [.], seq 8480:8640, ack 1, win 65280, length 160
1338628026.379560 IP 10.0.0.2.39100 > 178.11.0.2.5001: Flags [.], seq 8640:8800, ack 1, win 65280, length 160
1338628026.379608 IP 10.0.0.2.39100 > 178.11.0.2.5001: Flags [.], seq 8800:8960, ack 1, win 65280, length 160
1338628026.379610 IP 10.0.0.2.39100 > 178.11.0.2.5001: Flags [.], seq 8960:9120, ack 1, win 65280, length 160
1338628026.379611 IP 10.0.0.2.39100 > 178.11.0.2.5001: Flags [.], seq 9120:9280, ack 1, win 65280, length 160
1338628026.379612 IP 10.0.0.2.39100 > 178.11.0.2.5001: Flags [.], seq 9280:9440, ack 1, win 65280, length 160
1338628026.379613 IP 10.0.0.2.39100 > 178.11.0.2.5001: Flags [.], seq 9440:9600, ack 1, win 65280, length 160
1338628026.379622 IP 10.0.0.2.39100 > 178.11.0.2.5001: Flags [.], seq 9600:9760, ack 1, win 65280, length 160
1338628026.379624 IP 10.0.0.2.39100 > 178.11.0.2.5001: Flags [.], seq 9760:9920, ack 1, win 65280, length 160
1338628026.379625 IP 10.0.0.2.39100 > 178.11.0.2.5001: Flags [.], seq 9920:10080, ack 1, win 65280, length 160
1338628026.379626 IP 10.0.0.2.39100 > 178.11.0.2.5001: Flags [P.], seq 10080:10240, ack 1, win 65280, length 160
1338628026.379627 IP 10.0.0.2.39100 > 178.11.0.2.5001: Flags [.], seq 10240:10400, ack 1, win 65280, length 160
1338628026.379628 IP 10.0.0.2.39100 > 178.11.0.2.5001: Flags [.], seq 10400:10560, ack 1, win 65280, length 160
1338628026.379628 IP 10.0.0.2.39100 > 178.11.0.2.5001: Flags [.], seq 10560:10720, ack 1, win 65280, length 160
1338628026.379629 IP 10.0.0.2.39100 > 178.11.0.2.5001: Flags [.], seq 10720:10880, ack 1, win 65280, length 160
1338628026.379631 IP 10.0.0.2.39100 > 178.11.0.2.5001: Flags [.], seq 10880:11040, ack 1, win 65280, length 160
1338628026.580541 IP 10.0.0.2.39100 > 178.11.0.2.5001: Flags [.], seq 11040:11200, ack 1, win 65280, length 160
1338628026.580552 IP 10.0.0.2.39100 > 178.11.0.2.5001: Flags [.], seq 11200:11360, ack 1, win 65280, length 160
1338628026.580570 IP 10.0.0.2.39100 > 178.11.0.2.5001: Flags [.], seq 6400:6560, ack 1, win 65280, length 160
1338628026.580571 IP 10.0.0.2.39100 > 178.11.0.2.5001: Flags [.], seq 11360:11520, ack 1, win 65280, length 160
1338628026.580575 IP 10.0.0.2.39100 > 178.11.0.2.5001: Flags [.], seq 11520:11680, ack 1, win 65280, length 160
1338628026.580577 IP 10.0.0.2.39100 > 178.11.0.2.5001: Flags [.], seq 11680:11840, ack 1, win 65280, length 160
1338628026.580581 IP 10.0.0.2.39100 > 178.11.0.2.5001: Flags [.], seq 11840:12000, ack 1, win 65280, length 160
1338628026.782172 IP 10.0.0.2.39100 > 178.11.0.2.5001: Flags [.], seq 12000:12160, ack 1, win 65280, length 160
1338628026.782216 IP 10.0.0.2.39100 > 178.11.0.2.5001: Flags [.], seq 12160:12320, ack 1, win 65280, length 160
1338628026.782253 IP 10.0.0.2.39100 > 178.11.0.2.5001: Flags [.], seq 6560:6720, ack 1, win 65280, length 160
1338628026.782263 IP 10.0.0.2.39100 > 178.11.0.2.5001: Flags [.], seq 12320:12480, ack 1, win 65280, length 160
1338628026.782276 IP 10.0.0.2.39100 > 178.11.0.2.5001: Flags [.], seq 12480:12640, ack 1, win 65280, length 160
1338628026.782286 IP 10.0.0.2.39100 > 178.11.0.2.5001: Flags [.], seq 12640:12800, ack 1, win 65280, length 160
1338628026.782299 IP 10.0.0.2.39100 > 178.11.0.2.5001: Flags [.], seq 12800:12960, ack 1, win 65280, length 160
1338628026.983259 IP 10.0.0.2.39100 > 178.11.0.2.5001: Flags [.], seq 12960:13120, ack 1, win 65280, length 160
1338628026.983276 IP 10.0.0.2.39100 > 178.11.0.2.5001: Flags [.], seq 13120:13280, ack 1, win 65280, length 160
1338628026.983294 IP 10.0.0.2.39100 > 178.11.0.2.5001: Flags [.], seq 6720:6880, ack 1, win 65280, length 160
1338628026.983295 IP 10.0.0.2.39100 > 178.11.0.2.5001: Flags [.], seq 13280:13440, ack 1, win 65280, length 160
1338628026.983298 IP 10.0.0.2.39100 > 178.11.0.2.5001: Flags [.], seq 13440:13600, ack 1, win 65280, length 160
1338628026.983299 IP 10.0.0.2.39100 > 178.11.0.2.5001: Flags [.], seq 13600:13760, ack 1, win 65280, length 160
1338628026.983302 IP 10.0.0.2.39100 > 178.11.0.2.5001: Flags [.], seq 13760:13920, ack 1, win 65280, length 160
1338628027.184068 IP 10.0.0.2.39100 > 178.11.0.2.5001: Flags [.], seq 13920:14080, ack 1, win 65280, length 160
1338628027.184108 IP 10.0.0.2.39100 > 178.11.0.2.5001: Flags [.], seq 6880:7040, ack 1, win 65280, length 160
1338628027.184205 IP 10.0.0.2.39100 > 178.11.0.2.5001: Flags [.], seq 14080:14240, ack 1, win 65280, length 160
1338628027.184210 IP 10.0.0.2.39100 > 178.11.0.2.5001: Flags [.], seq 14240:14400, ack 1, win 65280, length 160
1338628027.184217 IP 10.0.0.2.39100 > 178.11.0.2.5001: Flags [.], seq 14400:14560, ack 1, win 65280, length 160
1338628027.184221 IP 10.0.0.2.39100 > 178.11.0.2.5001: Flags [.], seq 14560:14720, ack 1, win 65280, length 160
1338628027.386144 IP 10.0.0.2.39100 > 178.11.0.2.5001: Flags [.], seq 7040:7200, ack 1, win 65280, length 160
1338628027.587093 IP 10.0.0.2.39100 > 178.11.0.2.5001: Flags [.], seq 9760:9920, ack 1, win 65280, length 160
1338628027.587110 IP 10.0.0.2.39100 > 178.11.0.2.5001: Flags [.], seq 14720:14880, ack 1, win 65280, length 160
1338628027.787991 IP 10.0.0.2.39100 > 178.11.0.2.5001: Flags [.], seq 9920:10080, ack 1, win 65280, length 160
1338628027.788023 IP 10.0.0.2.39100 > 178.11.0.2.5001: Flags [.], seq 14880:15040, ack 1, win 65280, length 160
1338628027.988913 IP 10.0.0.2.39100 > 178.11.0.2.5001: Flags [P.], seq 10080:10240, ack 1, win 65280, length 160
1338628027.988929 IP 10.0.0.2.39100 > 178.11.0.2.5001: Flags [.], seq 15040:15200, ack 1, win 65280, length 160
1338628028.190586 IP 10.0.0.2.39100 > 178.11.0.2.5001: Flags [.], seq 10240:10400, ack 1, win 65280, length 160
1338628028.190669 IP 10.0.0.2.39100 > 178.11.0.2.5001: Flags [.], seq 15200:15360, ack 1, win 65280, length 160
1338628028.391643 IP 10.0.0.2.39100 > 178.11.0.2.5001: Flags [.], seq 10400:10560, ack 1, win 65280, length 160
1338628028.391676 IP 10.0.0.2.39100 > 178.11.0.2.5001: Flags [.], seq 15360:15520, ack 1, win 65280, length 160
1338628028.593657 IP 10.0.0.2.39100 > 178.11.0.2.5001: Flags [.], seq 10560:10720, ack 1, win 65280, length 160
1338628028.593685 IP 10.0.0.2.39100 > 178.11.0.2.5001: Flags [.], seq 15520:15680, ack 1, win 65280, length 160
1338628028.794712 IP 10.0.0.2.39100 > 178.11.0.2.5001: Flags [.], seq 10720:10880, ack 1, win 65280, length 160
1338628028.794743 IP 10.0.0.2.39100 > 178.11.0.2.5001: Flags [.], seq 15680:15840, ack 1, win 65280, length 160
1338628028.995990 IP 10.0.0.2.39100 > 178.11.0.2.5001: Flags [.], seq 10880:11040, ack 1, win 65280, length 160
1338628028.996015 IP 10.0.0.2.39100 > 178.11.0.2.5001: Flags [.], seq 15840:16000, ack 1, win 65280, length 160
1338628029.196978 IP 10.0.0.2.39100 > 178.11.0.2.5001: Flags [.], seq 11040:11200, ack 1, win 65280, length 160
1338628029.196996 IP 10.0.0.2.39100 > 178.11.0.2.5001: Flags [.], seq 16000:16160, ack 1, win 65280, length 160

117 packets captured
117 packets received by filter
0 packets dropped by kernel
