tcpdump: verbose output suppressed, use -v or -vv for full protocol decode
listening on sender-eth0, link-type EN10MB (Ethernet), capture size 65535 bytes
1338628036.670701 IP 10.0.0.2.46842 > 186.11.0.2.5001: Flags [S], seq 136911749, win 65280, options [mss 256,sackOK,TS val 2083104 ecr 0,nop,wscale 9], length 0
1338628036.871566 IP 10.0.0.2.46842 > 186.11.0.2.5001: Flags [.], ack 6511, win 65280, length 0
1338628036.871592 IP 10.0.0.2.46842 > 186.11.0.2.5001: Flags [.], seq 0:160, ack 1, win 65280, length 160
1338628036.871629 IP 10.0.0.2.46842 > 186.11.0.2.5001: Flags [.], seq 160:320, ack 1, win 65280, length 160
1338628036.871632 IP 10.0.0.2.46842 > 186.11.0.2.5001: Flags [.], seq 320:480, ack 1, win 65280, length 160
1338628036.871651 IP 10.0.0.2.46842 > 186.11.0.2.5001: Flags [.], seq 480:640, ack 1, win 65280, length 160
1338628036.871654 IP 10.0.0.2.46842 > 186.11.0.2.5001: Flags [.], seq 640:800, ack 1, win 65280, length 160
1338628036.871661 IP 10.0.0.2.46842 > 186.11.0.2.5001: Flags [.], seq 800:960, ack 1, win 65280, length 160
1338628036.871664 IP 10.0.0.2.46842 > 186.11.0.2.5001: Flags [.], seq 960:1120, ack 1, win 65280, length 160
1338628036.871670 IP 10.0.0.2.46842 > 186.11.0.2.5001: Flags [.], seq 1120:1280, ack 1, win 65280, length 160
1338628036.871673 IP 10.0.0.2.46842 > 186.11.0.2.5001: Flags [.], seq 1280:1440, ack 1, win 65280, length 160
1338628036.872397 IP 10.0.0.2.46842 > 186.11.0.2.5001: Flags [.], seq 1440:1600, ack 1, win 65280, length 160
1338628037.074938 IP 10.0.0.2.46842 > 186.11.0.2.5001: Flags [.], seq 1600:1760, ack 1, win 65280, length 160
1338628037.074966 IP 10.0.0.2.46842 > 186.11.0.2.5001: Flags [.], seq 1760:1920, ack 1, win 65280, length 160
1338628037.074998 IP 10.0.0.2.46842 > 186.11.0.2.5001: Flags [.], seq 1920:2080, ack 1, win 65280, length 160
1338628037.075009 IP 10.0.0.2.46842 > 186.11.0.2.5001: Flags [.], seq 2080:2240, ack 1, win 65280, length 160
1338628037.075023 IP 10.0.0.2.46842 > 186.11.0.2.5001: Flags [.], seq 2240:2400, ack 1, win 65280, length 160
1338628037.075033 IP 10.0.0.2.46842 > 186.11.0.2.5001: Flags [P.], seq 2400:2560, ack 1, win 65280, length 160
1338628037.075046 IP 10.0.0.2.46842 > 186.11.0.2.5001: Flags [.], seq 2560:2720, ack 1, win 65280, length 160
1338628037.075056 IP 10.0.0.2.46842 > 186.11.0.2.5001: Flags [.], seq 2720:2880, ack 1, win 65280, length 160
1338628037.075079 IP 10.0.0.2.46842 > 186.11.0.2.5001: Flags [.], seq 2880:3040, ack 1, win 65280, length 160
1338628037.075089 IP 10.0.0.2.46842 > 186.11.0.2.5001: Flags [.], seq 3040:3200, ack 1, win 65280, length 160
1338628037.075200 IP 10.0.0.2.46842 > 186.11.0.2.5001: Flags [.], seq 3200:3360, ack 1, win 65280, length 160
1338628037.075202 IP 10.0.0.2.46842 > 186.11.0.2.5001: Flags [.], seq 3360:3520, ack 1, win 65280, length 160
1338628037.075203 IP 10.0.0.2.46842 > 186.11.0.2.5001: Flags [.], seq 3520:3680, ack 1, win 65280, length 160
1338628037.075204 IP 10.0.0.2.46842 > 186.11.0.2.5001: Flags [.], seq 3680:3840, ack 1, win 65280, length 160
1338628037.075205 IP 10.0.0.2.46842 > 186.11.0.2.5001: Flags [.], seq 3840:4000, ack 1, win 65280, length 160
1338628037.075205 IP 10.0.0.2.46842 > 186.11.0.2.5001: Flags [P.], seq 4000:4096, ack 1, win 65280, length 96
1338628037.075207 IP 10.0.0.2.46842 > 186.11.0.2.5001: Flags [.], seq 4096:4256, ack 1, win 65280, length 160
1338628037.075208 IP 10.0.0.2.46842 > 186.11.0.2.5001: Flags [.], seq 4256:4416, ack 1, win 65280, length 160
1338628037.075209 IP 10.0.0.2.46842 > 186.11.0.2.5001: Flags [.], seq 4416:4576, ack 1, win 65280, length 160
1338628037.275563 IP 10.0.0.2.46842 > 186.11.0.2.5001: Flags [.], seq 4576:4736, ack 1, win 65280, length 160
1338628037.275583 IP 10.0.0.2.46842 > 186.11.0.2.5001: Flags [.], seq 4736:4896, ack 1, win 65280, length 160
1338628037.275607 IP 10.0.0.2.46842 > 186.11.0.2.5001: Flags [.], seq 4896:5056, ack 1, win 65280, length 160
1338628037.275610 IP 10.0.0.2.46842 > 186.11.0.2.5001: Flags [.], seq 5056:5216, ack 1, win 65280, length 160
1338628037.275617 IP 10.0.0.2.46842 > 186.11.0.2.5001: Flags [.], seq 5216:5376, ack 1, win 65280, length 160
1338628037.275620 IP 10.0.0.2.46842 > 186.11.0.2.5001: Flags [.], seq 5376:5536, ack 1, win 65280, length 160
1338628037.275626 IP 10.0.0.2.46842 > 186.11.0.2.5001: Flags [.], seq 5536:5696, ack 1, win 65280, length 160
1338628037.275629 IP 10.0.0.2.46842 > 186.11.0.2.5001: Flags [.], seq 5696:5856, ack 1, win 65280, length 160
1338628037.275637 IP 10.0.0.2.46842 > 186.11.0.2.5001: Flags [.], seq 5856:6016, ack 1, win 65280, length 160
1338628037.275639 IP 10.0.0.2.46842 > 186.11.0.2.5001: Flags [.], seq 6016:6176, ack 1, win 65280, length 160
1338628037.275711 IP 10.0.0.2.46842 > 186.11.0.2.5001: Flags [.], seq 6176:6336, ack 1, win 65280, length 160
1338628037.275716 IP 10.0.0.2.46842 > 186.11.0.2.5001: Flags [.], seq 6336:6496, ack 1, win 65280, length 160
1338628037.275718 IP 10.0.0.2.46842 > 186.11.0.2.5001: Flags [.], seq 6496:6656, ack 1, win 65280, length 160
1338628037.275720 IP 10.0.0.2.46842 > 186.11.0.2.5001: Flags [.], seq 6656:6816, ack 1, win 65280, length 160
1338628037.275723 IP 10.0.0.2.46842 > 186.11.0.2.5001: Flags [.], seq 6816:6976, ack 1, win 65280, length 160
1338628037.275725 IP 10.0.0.2.46842 > 186.11.0.2.5001: Flags [.], seq 6976:7136, ack 1, win 65280, length 160
1338628037.275727 IP 10.0.0.2.46842 > 186.11.0.2.5001: Flags [.], seq 7136:7296, ack 1, win 65280, length 160
1338628037.275729 IP 10.0.0.2.46842 > 186.11.0.2.5001: Flags [.], seq 7296:7456, ack 1, win 65280, length 160
1338628037.275731 IP 10.0.0.2.46842 > 186.11.0.2.5001: Flags [.], seq 7456:7616, ack 1, win 65280, length 160
1338628037.275733 IP 10.0.0.2.46842 > 186.11.0.2.5001: Flags [.], seq 7616:7776, ack 1, win 65280, length 160
1338628037.275735 IP 10.0.0.2.46842 > 186.11.0.2.5001: Flags [.], seq 7776:7936, ack 1, win 65280, length 160
1338628037.275738 IP 10.0.0.2.46842 > 186.11.0.2.5001: Flags [.], seq 7936:8096, ack 1, win 65280, length 160
1338628037.277275 IP 10.0.0.2.46842 > 186.11.0.2.5001: Flags [.], seq 8096:8256, ack 1, win 65280, length 160
1338628037.277396 IP 10.0.0.2.46842 > 186.11.0.2.5001: Flags [.], seq 8256:8416, ack 1, win 65280, length 160
1338628037.277509 IP 10.0.0.2.46842 > 186.11.0.2.5001: Flags [.], seq 8416:8576, ack 1, win 65280, length 160
1338628037.277546 IP 10.0.0.2.46842 > 186.11.0.2.5001: Flags [.], seq 8576:8736, ack 1, win 65280, length 160
1338628037.277585 IP 10.0.0.2.46842 > 186.11.0.2.5001: Flags [.], seq 8736:8896, ack 1, win 65280, length 160
1338628037.277618 IP 10.0.0.2.46842 > 186.11.0.2.5001: Flags [.], seq 8896:9056, ack 1, win 65280, length 160
1338628037.277654 IP 10.0.0.2.46842 > 186.11.0.2.5001: Flags [.], seq 9056:9216, ack 1, win 65280, length 160
1338628037.277683 IP 10.0.0.2.46842 > 186.11.0.2.5001: Flags [.], seq 9216:9376, ack 1, win 65280, length 160
1338628037.277717 IP 10.0.0.2.46842 > 186.11.0.2.5001: Flags [.], seq 9376:9536, ack 1, win 65280, length 160
1338628037.277745 IP 10.0.0.2.46842 > 186.11.0.2.5001: Flags [.], seq 9536:9696, ack 1, win 65280, length 160
1338628037.277797 IP 10.0.0.2.46842 > 186.11.0.2.5001: Flags [.], seq 9696:9856, ack 1, win 65280, length 160
1338628037.277823 IP 10.0.0.2.46842 > 186.11.0.2.5001: Flags [P.], seq 9856:10016, ack 1, win 65280, length 160
1338628037.277848 IP 10.0.0.2.46842 > 186.11.0.2.5001: Flags [.], seq 10016:10176, ack 1, win 65280, length 160
1338628037.277872 IP 10.0.0.2.46842 > 186.11.0.2.5001: Flags [.], seq 10176:10336, ack 1, win 65280, length 160
1338628037.374286 IP 10.0.0.2.46842 > 186.11.0.2.5001: Flags [.], seq 10336:10496, ack 1, win 65280, length 160
1338628037.374314 IP 10.0.0.2.46842 > 186.11.0.2.5001: Flags [.], seq 10496:10656, ack 1, win 65280, length 160
1338628037.477554 IP 10.0.0.2.46842 > 186.11.0.2.5001: Flags [.], seq 10656:10816, ack 1, win 65280, length 160
1338628037.477580 IP 10.0.0.2.46842 > 186.11.0.2.5001: Flags [.], seq 10816:10976, ack 1, win 65280, length 160
1338628037.477614 IP 10.0.0.2.46842 > 186.11.0.2.5001: Flags [.], seq 10976:11136, ack 1, win 65280, length 160
1338628037.477617 IP 10.0.0.2.46842 > 186.11.0.2.5001: Flags [.], seq 11136:11296, ack 1, win 65280, length 160
1338628037.477635 IP 10.0.0.2.46842 > 186.11.0.2.5001: Flags [.], seq 11296:11456, ack 1, win 65280, length 160
1338628037.477638 IP 10.0.0.2.46842 > 186.11.0.2.5001: Flags [.], seq 11456:11616, ack 1, win 65280, length 160
1338628037.477645 IP 10.0.0.2.46842 > 186.11.0.2.5001: Flags [.], seq 11616:11776, ack 1, win 65280, length 160
1338628037.477647 IP 10.0.0.2.46842 > 186.11.0.2.5001: Flags [.], seq 11776:11936, ack 1, win 65280, length 160
1338628037.477653 IP 10.0.0.2.46842 > 186.11.0.2.5001: Flags [.], seq 11936:12096, ack 1, win 65280, length 160
1338628037.477656 IP 10.0.0.2.46842 > 186.11.0.2.5001: Flags [.], seq 12096:12256, ack 1, win 65280, length 160
1338628037.477729 IP 10.0.0.2.46842 > 186.11.0.2.5001: Flags [.], seq 12256:12416, ack 1, win 65280, length 160
1338628037.477733 IP 10.0.0.2.46842 > 186.11.0.2.5001: Flags [.], seq 12416:12576, ack 1, win 65280, length 160
1338628037.480363 IP 10.0.0.2.46842 > 186.11.0.2.5001: Flags [.], seq 12576:12736, ack 1, win 65280, length 160
1338628037.480374 IP 10.0.0.2.46842 > 186.11.0.2.5001: Flags [.], seq 12736:12896, ack 1, win 65280, length 160
1338628037.480390 IP 10.0.0.2.46842 > 186.11.0.2.5001: Flags [.], seq 12896:13056, ack 1, win 65280, length 160
1338628037.480392 IP 10.0.0.2.46842 > 186.11.0.2.5001: Flags [.], seq 13056:13216, ack 1, win 65280, length 160
1338628037.480397 IP 10.0.0.2.46842 > 186.11.0.2.5001: Flags [.], seq 13216:13376, ack 1, win 65280, length 160
1338628037.480399 IP 10.0.0.2.46842 > 186.11.0.2.5001: Flags [.], seq 13376:13536, ack 1, win 65280, length 160
1338628037.480404 IP 10.0.0.2.46842 > 186.11.0.2.5001: Flags [.], seq 13536:13696, ack 1, win 65280, length 160
1338628037.480406 IP 10.0.0.2.46842 > 186.11.0.2.5001: Flags [.], seq 13696:13856, ack 1, win 65280, length 160
1338628037.480410 IP 10.0.0.2.46842 > 186.11.0.2.5001: Flags [.], seq 13856:14016, ack 1, win 65280, length 160
1338628037.480412 IP 10.0.0.2.46842 > 186.11.0.2.5001: Flags [.], seq 14016:14176, ack 1, win 65280, length 160
1338628037.480468 IP 10.0.0.2.46842 > 186.11.0.2.5001: Flags [.], seq 14176:14336, ack 1, win 65280, length 160
1338628037.480472 IP 10.0.0.2.46842 > 186.11.0.2.5001: Flags [.], seq 14336:14496, ack 1, win 65280, length 160
1338628037.480473 IP 10.0.0.2.46842 > 186.11.0.2.5001: Flags [.], seq 14496:14656, ack 1, win 65280, length 160
1338628037.575286 IP 10.0.0.2.46842 > 186.11.0.2.5001: Flags [.], seq 14656:14816, ack 1, win 65280, length 160
1338628037.575300 IP 10.0.0.2.46842 > 186.11.0.2.5001: Flags [.], seq 14816:14976, ack 1, win 65280, length 160
1338628037.575318 IP 10.0.0.2.46842 > 186.11.0.2.5001: Flags [.], seq 14976:15136, ack 1, win 65280, length 160
1338628037.678472 IP 10.0.0.2.46842 > 186.11.0.2.5001: Flags [.], seq 7136:7296, ack 1, win 65280, length 160
1338628037.884116 IP 10.0.0.2.46842 > 186.11.0.2.5001: Flags [.], seq 7296:7456, ack 1, win 65280, length 160
1338628038.133145 IP 10.0.0.2.46842 > 186.11.0.2.5001: Flags [.], seq 15136:15296, ack 1, win 65280, length 160
1338628038.133161 IP 10.0.0.2.46842 > 186.11.0.2.5001: Flags [.], seq 15296:15456, ack 1, win 65280, length 160
1338628038.133184 IP 10.0.0.2.46842 > 186.11.0.2.5001: Flags [.], seq 7456:7616, ack 1, win 65280, length 160
1338628038.384809 IP 10.0.0.2.46842 > 186.11.0.2.5001: Flags [.], seq 7616:7776, ack 1, win 65280, length 160
1338628038.635994 IP 10.0.0.2.46842 > 186.11.0.2.5001: Flags [.], seq 15456:15616, ack 1, win 65280, length 160
1338628038.636019 IP 10.0.0.2.46842 > 186.11.0.2.5001: Flags [.], seq 15616:15776, ack 1, win 65280, length 160
1338628038.636034 IP 10.0.0.2.46842 > 186.11.0.2.5001: Flags [.], seq 7776:7936, ack 1, win 65280, length 160
1338628038.887656 IP 10.0.0.2.46842 > 186.11.0.2.5001: Flags [.], seq 7936:8096, ack 1, win 65280, length 160
1338628039.088848 IP 10.0.0.2.46842 > 186.11.0.2.5001: Flags [.], seq 9836:9856, ack 1, win 65280, length 20
1338628039.088878 IP 10.0.0.2.46842 > 186.11.0.2.5001: Flags [.], seq 15776:15936, ack 1, win 65280, length 160
1338628039.088908 IP 10.0.0.2.46842 > 186.11.0.2.5001: Flags [.], seq 15936:16096, ack 1, win 65280, length 160
1338628039.088911 IP 10.0.0.2.46842 > 186.11.0.2.5001: Flags [.], seq 16096:16256, ack 1, win 65280, length 160
1338628039.088918 IP 10.0.0.2.46842 > 186.11.0.2.5001: Flags [.], seq 16256:16416, ack 1, win 65280, length 160
1338628039.088921 IP 10.0.0.2.46842 > 186.11.0.2.5001: Flags [.], seq 16416:16576, ack 1, win 65280, length 160
1338628039.088928 IP 10.0.0.2.46842 > 186.11.0.2.5001: Flags [.], seq 16576:16736, ack 1, win 65280, length 160
1338628039.088930 IP 10.0.0.2.46842 > 186.11.0.2.5001: Flags [.], seq 16736:16896, ack 1, win 65280, length 160
1338628039.088936 IP 10.0.0.2.46842 > 186.11.0.2.5001: Flags [.], seq 16896:17056, ack 1, win 65280, length 160
1338628039.088939 IP 10.0.0.2.46842 > 186.11.0.2.5001: Flags [.], seq 17056:17216, ack 1, win 65280, length 160
1338628039.089003 IP 10.0.0.2.46842 > 186.11.0.2.5001: Flags [.], seq 17216:17376, ack 1, win 65280, length 160
1338628039.089007 IP 10.0.0.2.46842 > 186.11.0.2.5001: Flags [.], seq 17376:17536, ack 1, win 65280, length 160
1338628039.089010 IP 10.0.0.2.46842 > 186.11.0.2.5001: Flags [.], seq 17536:17696, ack 1, win 65280, length 160
1338628039.089012 IP 10.0.0.2.46842 > 186.11.0.2.5001: Flags [.], seq 17696:17856, ack 1, win 65280, length 160
1338628039.089015 IP 10.0.0.2.46842 > 186.11.0.2.5001: Flags [P.], seq 9856:10016, ack 1, win 65280, length 160
1338628039.388245 IP 10.0.0.2.46842 > 186.11.0.2.5001: Flags [.], seq 10016:10176, ack 1, win 65280, length 160
1338628039.639547 IP 10.0.0.2.46842 > 186.11.0.2.5001: Flags [.], seq 17856:18016, ack 1, win 65280, length 160
1338628039.639564 IP 10.0.0.2.46842 > 186.11.0.2.5001: Flags [.], seq 18016:18176, ack 1, win 65280, length 160
1338628039.639589 IP 10.0.0.2.46842 > 186.11.0.2.5001: Flags [.], seq 10176:10336, ack 1, win 65280, length 160
1338628039.890980 IP 10.0.0.2.46842 > 186.11.0.2.5001: Flags [.], seq 11116:11136, ack 1, win 65280, length 20
1338628039.890996 IP 10.0.0.2.46842 > 186.11.0.2.5001: Flags [.], seq 18176:18336, ack 1, win 65280, length 160
1338628039.891013 IP 10.0.0.2.46842 > 186.11.0.2.5001: Flags [.], seq 18336:18496, ack 1, win 65280, length 160
1338628039.891014 IP 10.0.0.2.46842 > 186.11.0.2.5001: Flags [.], seq 18496:18656, ack 1, win 65280, length 160
1338628039.891017 IP 10.0.0.2.46842 > 186.11.0.2.5001: Flags [.], seq 18656:18816, ack 1, win 65280, length 160
1338628039.891018 IP 10.0.0.2.46842 > 186.11.0.2.5001: Flags [.], seq 18816:18976, ack 1, win 65280, length 160
1338628039.891021 IP 10.0.0.2.46842 > 186.11.0.2.5001: Flags [.], seq 18976:19136, ack 1, win 65280, length 160
1338628039.891023 IP 10.0.0.2.46842 > 186.11.0.2.5001: Flags [.], seq 11136:11296, ack 1, win 65280, length 160
1338628040.142042 IP 10.0.0.2.46842 > 186.11.0.2.5001: Flags [.], seq 11296:11456, ack 1, win 65280, length 160
1338628040.393207 IP 10.0.0.2.46842 > 186.11.0.2.5001: Flags [.], seq 19136:19296, ack 1, win 65280, length 160
1338628040.393237 IP 10.0.0.2.46842 > 186.11.0.2.5001: Flags [.], seq 19296:19456, ack 1, win 65280, length 160
1338628040.393269 IP 10.0.0.2.46842 > 186.11.0.2.5001: Flags [.], seq 11456:11616, ack 1, win 65280, length 160
1338628040.644310 IP 10.0.0.2.46842 > 186.11.0.2.5001: Flags [.], seq 11616:11776, ack 1, win 65280, length 160
1338628040.895659 IP 10.0.0.2.46842 > 186.11.0.2.5001: Flags [.], seq 19456:19616, ack 1, win 65280, length 160
1338628040.895681 IP 10.0.0.2.46842 > 186.11.0.2.5001: Flags [.], seq 19616:19776, ack 1, win 65280, length 160
1338628040.895702 IP 10.0.0.2.46842 > 186.11.0.2.5001: Flags [.], seq 11776:11936, ack 1, win 65280, length 160
1338628041.147602 IP 10.0.0.2.46842 > 186.11.0.2.5001: Flags [.], seq 11936:12096, ack 1, win 65280, length 160
1338628041.397232 IP 10.0.0.2.46842 > 186.11.0.2.5001: Flags [.], seq 19776:19936, ack 1, win 65280, length 160
1338628041.397248 IP 10.0.0.2.46842 > 186.11.0.2.5001: Flags [.], seq 19936:20096, ack 1, win 65280, length 160
1338628041.397274 IP 10.0.0.2.46842 > 186.11.0.2.5001: Flags [.], seq 12096:12256, ack 1, win 65280, length 160
1338628041.647082 IP 10.0.0.2.46842 > 186.11.0.2.5001: Flags [.], seq 12256:12416, ack 1, win 65280, length 160
1338628041.900719 IP 10.0.0.2.46842 > 186.11.0.2.5001: Flags [.], seq 20096:20256, ack 1, win 65280, length 160
1338628041.900751 IP 10.0.0.2.46842 > 186.11.0.2.5001: Flags [.], seq 20256:20416, ack 1, win 65280, length 160
1338628041.900785 IP 10.0.0.2.46842 > 186.11.0.2.5001: Flags [.], seq 12416:12576, ack 1, win 65280, length 160
1338628042.152027 IP 10.0.0.2.46842 > 186.11.0.2.5001: Flags [.], seq 12576:12736, ack 1, win 65280, length 160
1338628042.401679 IP 10.0.0.2.46842 > 186.11.0.2.5001: Flags [.], seq 20416:20576, ack 1, win 65280, length 160
1338628042.401710 IP 10.0.0.2.46842 > 186.11.0.2.5001: Flags [.], seq 20576:20736, ack 1, win 65280, length 160
1338628042.401744 IP 10.0.0.2.46842 > 186.11.0.2.5001: Flags [.], seq 12736:12896, ack 1, win 65280, length 160
1338628042.652989 IP 10.0.0.2.46842 > 186.11.0.2.5001: Flags [.], seq 12896:13056, ack 1, win 65280, length 160
1338628042.903227 IP 10.0.0.2.46842 > 186.11.0.2.5001: Flags [.], seq 20736:20896, ack 1, win 65280, length 160
1338628042.903251 IP 10.0.0.2.46842 > 186.11.0.2.5001: Flags [.], seq 20896:21056, ack 1, win 65280, length 160
1338628042.903278 IP 10.0.0.2.46842 > 186.11.0.2.5001: Flags [.], seq 13056:13216, ack 1, win 65280, length 160
1338628043.154338 IP 10.0.0.2.46842 > 186.11.0.2.5001: Flags [.], seq 13216:13376, ack 1, win 65280, length 160
1338628043.405277 IP 10.0.0.2.46842 > 186.11.0.2.5001: Flags [.], seq 21056:21216, ack 1, win 65280, length 160
1338628043.405299 IP 10.0.0.2.46842 > 186.11.0.2.5001: Flags [.], seq 21216:21376, ack 1, win 65280, length 160
1338628043.405322 IP 10.0.0.2.46842 > 186.11.0.2.5001: Flags [.], seq 13376:13536, ack 1, win 65280, length 160
1338628043.656200 IP 10.0.0.2.46842 > 186.11.0.2.5001: Flags [.], seq 13536:13696, ack 1, win 65280, length 160
1338628043.908790 IP 10.0.0.2.46842 > 186.11.0.2.5001: Flags [.], seq 21376:21536, ack 1, win 65280, length 160
1338628043.908823 IP 10.0.0.2.46842 > 186.11.0.2.5001: Flags [.], seq 21536:21696, ack 1, win 65280, length 160
1338628043.908857 IP 10.0.0.2.46842 > 186.11.0.2.5001: Flags [.], seq 13696:13856, ack 1, win 65280, length 160
1338628044.159110 IP 10.0.0.2.46842 > 186.11.0.2.5001: Flags [.], seq 13856:14016, ack 1, win 65280, length 160
1338628044.409108 IP 10.0.0.2.46842 > 186.11.0.2.5001: Flags [.], seq 21696:21856, ack 1, win 65280, length 160
1338628044.409139 IP 10.0.0.2.46842 > 186.11.0.2.5001: Flags [.], seq 21856:22016, ack 1, win 65280, length 160
1338628044.409174 IP 10.0.0.2.46842 > 186.11.0.2.5001: Flags [.], seq 14016:14176, ack 1, win 65280, length 160
1338628044.661575 IP 10.0.0.2.46842 > 186.11.0.2.5001: Flags [.], seq 14176:14336, ack 1, win 65280, length 160

171 packets captured
171 packets received by filter
0 packets dropped by kernel
